{
  "schemaVersion": "community-package-v1",
  "packageId": "cap.openclaw.sop.content-dev-integration",
  "type": "sop-pack",
  "name": "接口联调与调试",
  "version": "0.2.0",
  "author": {
    "name": "OpenClaw",
    "id": "official/openclaw"
  },
  "description": "服务对接、联调测试",
  "source": {
    "kind": "local-export",
    "createdAt": "2026-03-24T10:52:07Z"
  },
  "capabilities": [
    {
      "id": "cap.openclaw.sop.content-dev-integration",
      "label": "接口联调与调试",
      "summary": "服务对接、联调测试",
      "entrypoint": "__OPENCLAW_WORKFLOW__ sop-content-dev-integration"
    }
  ],
  "dependencies": [
    {
      "id": "cap.openclaw.foundation.files-repo",
      "label": "文件与版本管理",
      "kind": "foundation",
      "required": true,
      "installCommand": "read/write/edit/exec + git",
      "installUrl": "",
      "bundled": false
    }
  ],
  "compatibility": {
    "openclawMinVersion": "2026.3.2",
    "installMode": "local-console",
    "platforms": [
      "macos",
      "linux",
      "windows"
    ]
  },
  "permissions": [
    {
      "key": "filesystem.read",
      "required": true,
      "reason": "Read packaged SOP, docs, and supporting local files."
    }
  ],
  "checksums": {
    "algorithm": "sha256",
    "files": [
      {
        "path": "OPENCLAW.md",
        "sha256": "10a3b81a4e902c2d2cc2f0690c8b4098a9da5f2dc28da88b94142720d66eb9aa"
      },
      {
        "path": "README.md",
        "sha256": "149ea8b42b64fcb27fd20dc7bef11db28fecc087f900034f09231ddb0abc188f"
      },
      {
        "path": "capability-manifest.json",
        "sha256": "04526990c1ead06d32eb365a1d333e58e84ac246bf8b1a5f91abc34353c366d6"
      },
      {
        "path": "dependency-hints.json",
        "sha256": "be6d0881dbd9b9ec8cb3ff06dce7b866d7c4d7fb72fdf91c25877b9758d8c746"
      },
      {
        "path": "healthcheck.py",
        "sha256": "8e97303270b8f4e331f57a26d22c834d9f8f2017b13ade71ffc9a67dc28da90f"
      },
      {
        "path": "install.py",
        "sha256": "77e8fcd3502f13228cad7042f0992f46715f10f538bcc6a59b76fe7e79a43137"
      },
      {
        "path": "schemas/community-package-v1.schema.json",
        "sha256": "fbfce78f0b3bea1bb68dc0d51ca99e2149cb1743fae6f3c4825d1e881e7ec8d8"
      },
      {
        "path": "sops/接口联调与调试.md",
        "sha256": "d5dd14fde3a05b039f9ec529df3e29a446392283738833f77e1e0f2921f5c349"
      }
    ]
  },
  "docs": [
    {
      "title": "OPENCLAW",
      "path": "OPENCLAW.md"
    },
    {
      "title": "README",
      "path": "README.md"
    },
    {
      "title": "接口联调与调试",
      "path": "sops/接口联调与调试.md"
    }
  ],
  "assets": [
    {
      "path": "OPENCLAW.md",
      "kind": "knowledge",
      "label": "OPENCLAW.md"
    },
    {
      "path": "README.md",
      "kind": "knowledge",
      "label": "README.md"
    },
    {
      "path": "schemas/community-package-v1.schema.json",
      "kind": "document",
      "label": "community-package-v1.schema.json"
    },
    {
      "path": "sops/接口联调与调试.md",
      "kind": "knowledge",
      "label": "接口联调与调试.md"
    }
  ],
  "reviewStatus": "draft",
  "visibility": "private"
}