{
  "schemaVersion": "community-package-v1",
  "packageId": "cap.openclaw.sop.content-dev-planning",
  "type": "sop-pack",
  "name": "需求拆解与阶段计划",
  "version": "0.2.0",
  "author": {
    "name": "OpenClaw",
    "id": "official/openclaw"
  },
  "description": "研发计划、执行路线",
  "source": {
    "kind": "local-export",
    "createdAt": "2026-03-24T10:52:07Z"
  },
  "capabilities": [
    {
      "id": "cap.openclaw.sop.content-dev-planning",
      "label": "需求拆解与阶段计划",
      "summary": "研发计划、执行路线",
      "entrypoint": "__OPENCLAW_WORKFLOW__ sop-content-dev-planning"
    }
  ],
  "dependencies": [
    {
      "id": "cap.openclaw.foundation.files-repo",
      "label": "文件与版本管理",
      "kind": "foundation",
      "required": true,
      "installCommand": "read/write/edit/exec + git",
      "installUrl": "",
      "bundled": false
    }
  ],
  "compatibility": {
    "openclawMinVersion": "2026.3.2",
    "installMode": "local-console",
    "platforms": [
      "macos",
      "linux",
      "windows"
    ]
  },
  "permissions": [
    {
      "key": "filesystem.read",
      "required": true,
      "reason": "Read packaged SOP, docs, and supporting local files."
    }
  ],
  "checksums": {
    "algorithm": "sha256",
    "files": [
      {
        "path": "OPENCLAW.md",
        "sha256": "c3b6cbac80a24f7a2bbb1740b63002adc1c5b675a07733a8a2c6c1715e857612"
      },
      {
        "path": "README.md",
        "sha256": "08496602afe00f964d8b4a7adda51184ba4829d074eecfe3c96349ac37a9948d"
      },
      {
        "path": "capability-manifest.json",
        "sha256": "06adfa691a1e89914c6c5dc0a80996d0f489bb58da7a0a15f1fa3b83c73b9200"
      },
      {
        "path": "dependency-hints.json",
        "sha256": "be6d0881dbd9b9ec8cb3ff06dce7b866d7c4d7fb72fdf91c25877b9758d8c746"
      },
      {
        "path": "healthcheck.py",
        "sha256": "cc0d41d46f71780a8dff2dea03b103fcee9a3dc6f249dda180cb0daccea66414"
      },
      {
        "path": "install.py",
        "sha256": "d51e29f8b51099f99f0621b497c2af867e53e83787687972d323012569cb855d"
      },
      {
        "path": "schemas/community-package-v1.schema.json",
        "sha256": "fbfce78f0b3bea1bb68dc0d51ca99e2149cb1743fae6f3c4825d1e881e7ec8d8"
      },
      {
        "path": "sops/需求拆解与阶段计划.md",
        "sha256": "2ad70cdc8a1b433878373a42ba28052476d02b41a8bae94fc0adeda34cd2fce4"
      }
    ]
  },
  "docs": [
    {
      "title": "OPENCLAW",
      "path": "OPENCLAW.md"
    },
    {
      "title": "README",
      "path": "README.md"
    },
    {
      "title": "需求拆解与阶段计划",
      "path": "sops/需求拆解与阶段计划.md"
    }
  ],
  "assets": [
    {
      "path": "OPENCLAW.md",
      "kind": "knowledge",
      "label": "OPENCLAW.md"
    },
    {
      "path": "README.md",
      "kind": "knowledge",
      "label": "README.md"
    },
    {
      "path": "schemas/community-package-v1.schema.json",
      "kind": "document",
      "label": "community-package-v1.schema.json"
    },
    {
      "path": "sops/需求拆解与阶段计划.md",
      "kind": "knowledge",
      "label": "需求拆解与阶段计划.md"
    }
  ],
  "reviewStatus": "draft",
  "visibility": "private"
}