{
  "schemaVersion": "community-package-v1",
  "packageId": "cap.openclaw.sop.workflow-9fe1238c",
  "type": "sop-pack",
  "name": "技能缺口检查与安装计划",
  "version": "0.2.0",
  "author": {
    "name": "OpenClaw",
    "id": "official/openclaw"
  },
  "description": "针对一个目标 SOP 或目标任务，检查当前缺少哪些技能、能力包或集成，并输出安装与验证计划。",
  "source": {
    "kind": "local-export",
    "createdAt": "2026-03-24T10:52:07Z"
  },
  "capabilities": [
    {
      "id": "cap.openclaw.sop.workflow-9fe1238c",
      "label": "技能缺口检查与安装计划",
      "summary": "针对一个目标 SOP 或目标任务，检查当前缺少哪些技能、能力包或集成，并输出安装与验证计划。",
      "entrypoint": "__OPENCLAW_WORKFLOW__ sop-技能缺口检查与安装计划"
    },
    {
      "id": "cap.openclaw.skill.find-skills",
      "label": "find-skills",
      "summary": "Bundled supporting capability.",
      "entrypoint": ""
    }
  ],
  "dependencies": [
    {
      "id": "cap.openclaw.skill.find-skills",
      "label": "find-skills",
      "kind": "skill",
      "required": false,
      "installCommand": "claw skill install find-skills",
      "installUrl": "https://skills.sh/",
      "bundled": true
    }
  ],
  "compatibility": {
    "openclawMinVersion": "2026.3.2",
    "installMode": "local-console",
    "platforms": [
      "macos",
      "linux",
      "windows"
    ]
  },
  "permissions": [
    {
      "key": "filesystem.read",
      "required": true,
      "reason": "Read packaged SOP, docs, and supporting local files."
    }
  ],
  "checksums": {
    "algorithm": "sha256",
    "files": [
      {
        "path": "OPENCLAW.md",
        "sha256": "612fd9bc1fa2baa55c69bb47a02059121f0174714de21cca676ed1db6d6cbeff"
      },
      {
        "path": "README.md",
        "sha256": "321a08be5ead0fd2110c86e6db7294124b7e2cd0ec32aef3d55307ccd7297888"
      },
      {
        "path": "capability-manifest.json",
        "sha256": "8d83d232ec001b1e7096ff732fe569bc7c412f82441fd15a2d218d37e535f228"
      },
      {
        "path": "dependency-hints.json",
        "sha256": "43dac758bbc8c147d4f65c5ca3f91b5e475f8b4befb6c8f372a2f0a5c5da0ca0"
      },
      {
        "path": "healthcheck.py",
        "sha256": "f1e0e58e6cfa3e565b64fb4b4f78bb55ca8ab3c90d65426cd2dc9519e341c8c6"
      },
      {
        "path": "install.py",
        "sha256": "2f2a5f57ab25fcca31a6450f89cf2a19a7af28fadb9bf4c75d44cc5407599048"
      },
      {
        "path": "knowledge/skill_gap_install_plan.md",
        "sha256": "63b2b2514dfedd8a563d74fce6b35edb6c4b107c7a5d1754be51ce52a50acf8f"
      },
      {
        "path": "schemas/community-package-v1.schema.json",
        "sha256": "fbfce78f0b3bea1bb68dc0d51ca99e2149cb1743fae6f3c4825d1e881e7ec8d8"
      },
      {
        "path": "skills/find-skills/SKILL.md",
        "sha256": "1e85f6f9686e145aca4a124e3b704b9bbea9aa87e08515c1e352eee70f6e6e7a"
      },
      {
        "path": "sops/技能缺口检查与安装计划.md",
        "sha256": "93d792df693f3dfd1c9d87b624085b69156bad679379804a0feb28c44dc4e8e3"
      }
    ]
  },
  "docs": [
    {
      "title": "OPENCLAW",
      "path": "OPENCLAW.md"
    },
    {
      "title": "README",
      "path": "README.md"
    },
    {
      "title": "skill_gap_install_plan",
      "path": "knowledge/skill_gap_install_plan.md"
    },
    {
      "title": "SKILL",
      "path": "skills/find-skills/SKILL.md"
    },
    {
      "title": "技能缺口检查与安装计划",
      "path": "sops/技能缺口检查与安装计划.md"
    }
  ],
  "assets": [
    {
      "path": "OPENCLAW.md",
      "kind": "knowledge",
      "label": "OPENCLAW.md"
    },
    {
      "path": "README.md",
      "kind": "knowledge",
      "label": "README.md"
    },
    {
      "path": "knowledge/skill_gap_install_plan.md",
      "kind": "knowledge",
      "label": "skill_gap_install_plan.md"
    },
    {
      "path": "schemas/community-package-v1.schema.json",
      "kind": "document",
      "label": "community-package-v1.schema.json"
    },
    {
      "path": "skills/find-skills/SKILL.md",
      "kind": "knowledge",
      "label": "SKILL.md"
    },
    {
      "path": "sops/技能缺口检查与安装计划.md",
      "kind": "knowledge",
      "label": "技能缺口检查与安装计划.md"
    }
  ],
  "reviewStatus": "draft",
  "visibility": "private"
}