{
  "schemaVersion": "community-package-v1",
  "packageId": "cap.openclaw.sop.content-growth-plan",
  "type": "sop-pack",
  "name": "个人成长规划",
  "version": "0.2.0",
  "author": {
    "name": "OpenClaw",
    "id": "official/openclaw"
  },
  "description": "季度/年度成长规划、技能路线",
  "source": {
    "kind": "local-export",
    "createdAt": "2026-03-24T10:52:00Z"
  },
  "capabilities": [
    {
      "id": "cap.openclaw.sop.content-growth-plan",
      "label": "个人成长规划",
      "summary": "季度/年度成长规划、技能路线",
      "entrypoint": "/growth plan --goal <目标> --cycle <周期>"
    }
  ],
  "dependencies": [
    {
      "id": "cap.openclaw.foundation.files-repo",
      "label": "文件与版本管理",
      "kind": "foundation",
      "required": true,
      "installCommand": "read/write/edit/exec + git",
      "installUrl": "",
      "bundled": false
    },
    {
      "id": "cap.openclaw.foundation.knowledge-index",
      "label": "知识库归档与标签",
      "kind": "foundation",
      "required": true,
      "installCommand": "/knowledge ingest --domain <领域> --platform <平台>",
      "installUrl": "",
      "bundled": false
    }
  ],
  "compatibility": {
    "openclawMinVersion": "2026.3.2",
    "installMode": "local-console",
    "platforms": [
      "macos",
      "linux",
      "windows"
    ]
  },
  "permissions": [
    {
      "key": "filesystem.read",
      "required": true,
      "reason": "Read packaged SOP, docs, and supporting local files."
    }
  ],
  "checksums": {
    "algorithm": "sha256",
    "files": [
      {
        "path": "OPENCLAW.md",
        "sha256": "5749c052d58f0cf92da3fead71d3b429b61ce4dccf1fe54488c45c2d259e8f7e"
      },
      {
        "path": "README.md",
        "sha256": "b163b7803cf2b7a760821714258df31c25dbf57f3feb606642695fbb249d608b"
      },
      {
        "path": "capability-manifest.json",
        "sha256": "ef6017194f6574601d3bf829afb62f180bbe4ec4b37238748d3d2a81423faa0d"
      },
      {
        "path": "dependency-hints.json",
        "sha256": "afd6c8fe96087b9067433473b44c82476453fff6128ecba27db767ef25e1f87c"
      },
      {
        "path": "healthcheck.py",
        "sha256": "e3ca318b923ba94b072c36529191cc57fd1b1b58993c182a54e3133663df16eb"
      },
      {
        "path": "install.py",
        "sha256": "726780eb2ba9d05d6ab7893b22b928ec8db7166d6e5a8e0bef438e84e4495b13"
      },
      {
        "path": "schemas/community-package-v1.schema.json",
        "sha256": "fbfce78f0b3bea1bb68dc0d51ca99e2149cb1743fae6f3c4825d1e881e7ec8d8"
      },
      {
        "path": "sops/个人成长规划.md",
        "sha256": "5ec51a37a0d17209ec8ee73a398594aea8a6f9b708e29bfaa77b66dd42adfd10"
      }
    ]
  },
  "docs": [
    {
      "title": "OPENCLAW",
      "path": "OPENCLAW.md"
    },
    {
      "title": "README",
      "path": "README.md"
    },
    {
      "title": "个人成长规划",
      "path": "sops/个人成长规划.md"
    }
  ],
  "assets": [
    {
      "path": "OPENCLAW.md",
      "kind": "knowledge",
      "label": "OPENCLAW.md"
    },
    {
      "path": "README.md",
      "kind": "knowledge",
      "label": "README.md"
    },
    {
      "path": "schemas/community-package-v1.schema.json",
      "kind": "document",
      "label": "community-package-v1.schema.json"
    },
    {
      "path": "sops/个人成长规划.md",
      "kind": "knowledge",
      "label": "个人成长规划.md"
    }
  ],
  "reviewStatus": "draft",
  "visibility": "private"
}