{
  "schemaVersion": "community-package-v1",
  "packageId": "cap.openclaw.sop.content-research-experiment",
  "type": "sop-pack",
  "name": "实验设计与统计方法建议",
  "version": "0.2.0",
  "author": {
    "name": "OpenClaw",
    "id": "official/openclaw"
  },
  "description": "方案设计、验收建议",
  "source": {
    "kind": "local-export",
    "createdAt": "2026-03-24T10:52:07Z"
  },
  "capabilities": [
    {
      "id": "cap.openclaw.sop.content-research-experiment",
      "label": "实验设计与统计方法建议",
      "summary": "方案设计、验收建议",
      "entrypoint": "__OPENCLAW_WORKFLOW__ sop-content-research-experiment"
    }
  ],
  "dependencies": [
    {
      "id": "cap.openclaw.foundation.knowledge-index",
      "label": "知识库归档与标签",
      "kind": "foundation",
      "required": true,
      "installCommand": "/knowledge ingest --domain <领域> --platform <平台>",
      "installUrl": "",
      "bundled": false
    }
  ],
  "compatibility": {
    "openclawMinVersion": "2026.3.2",
    "installMode": "local-console",
    "platforms": [
      "macos",
      "linux",
      "windows"
    ]
  },
  "permissions": [
    {
      "key": "filesystem.read",
      "required": true,
      "reason": "Read packaged SOP, docs, and supporting local files."
    }
  ],
  "checksums": {
    "algorithm": "sha256",
    "files": [
      {
        "path": "OPENCLAW.md",
        "sha256": "05d267af788f2484caad4398dc0de334e762b1aef4e5b7956606260eb7b9f507"
      },
      {
        "path": "README.md",
        "sha256": "80e95ee30020c5cc39b1a5acbf4dc64b6207b3a69521814519608f642974258a"
      },
      {
        "path": "capability-manifest.json",
        "sha256": "b441ef152491bf3fc6dfd2b363ba05c3b202665e4c9c28cd47a85ba55db940a5"
      },
      {
        "path": "dependency-hints.json",
        "sha256": "d537f181ccff51a0b74563b60ddce2ae885597caad51c6ff566855d370cdc0f4"
      },
      {
        "path": "healthcheck.py",
        "sha256": "c711a74bf4df91ec014ea6db53e3bffd39001368621b36a986c818f76d6fca31"
      },
      {
        "path": "install.py",
        "sha256": "5fe5fcb168bb7ca039df169c2a999c013a5b3a30ed90420ef1c55ea3145da06e"
      },
      {
        "path": "schemas/community-package-v1.schema.json",
        "sha256": "fbfce78f0b3bea1bb68dc0d51ca99e2149cb1743fae6f3c4825d1e881e7ec8d8"
      },
      {
        "path": "sops/实验设计与统计方法建议.md",
        "sha256": "11af4c29258cf72f7fcc92919c09d12e5b3d241f3c9f26206c14fd14d957f573"
      }
    ]
  },
  "docs": [
    {
      "title": "OPENCLAW",
      "path": "OPENCLAW.md"
    },
    {
      "title": "README",
      "path": "README.md"
    },
    {
      "title": "实验设计与统计方法建议",
      "path": "sops/实验设计与统计方法建议.md"
    }
  ],
  "assets": [
    {
      "path": "OPENCLAW.md",
      "kind": "knowledge",
      "label": "OPENCLAW.md"
    },
    {
      "path": "README.md",
      "kind": "knowledge",
      "label": "README.md"
    },
    {
      "path": "schemas/community-package-v1.schema.json",
      "kind": "document",
      "label": "community-package-v1.schema.json"
    },
    {
      "path": "sops/实验设计与统计方法建议.md",
      "kind": "knowledge",
      "label": "实验设计与统计方法建议.md"
    }
  ],
  "reviewStatus": "draft",
  "visibility": "private"
}